schema,neg sentence,neg legal advice,risk level,legal basis,risk statement
产品质量,质量标准应符合相关法律规定|特价商品，不提供退换货服务，不开具发票。,产品质量条款缺失或约定不明确，建议补充完整。产品质量在货物买卖类合同中非常重要，双方应明确约定买卖标的物质量交付标准，选定一个具体的质量标准来执行，不可出现模糊化。如未约定质量条款，对于卖方来讲，买方可能会以不符合其质量标准为由拒绝签收或拒绝付款、少付款。,高,【《中华人民共和国民法典》第六百一十五条】出卖人应当按照约定的质量要求交付标的物。出卖人提供有关标的物质量说明的，交付的标的物应当符合该说明的质量要求。|【《中华人民共和国民法典》第六百一十六条】当事人对标的物的质量要求没有约定或者约定不明确，依据本法第五百一十条的规定仍不能确定的，适用本法第五百一十一条第一项的规定。|【《中华人民共和国民法典》第六百一十七条】出卖人交付的标的物不符合质量要求的，买受人可以依据本法第五百八十二条至第五百八十四条的规定请求承担违约责任。,产品质量关系买卖商品的交付及验收标准，应明确约定。
交货时间,如遇天气等不可抗力无法按时交货，乙方不承担违约责任。|如供应商缺货等原因，导致一方延迟交货，乙方不承担违约责任。,交付期限未严格按照合同约定执行，增加买方风险，建议核实。,高,【《中华人民共和国民法典》第六百零一条】出卖人应当按照约定的时间交付标的物。约定交付期限的，出卖人可以在该交付期限内的任何时间交付。,交付期限应严格执行，保障买房交易安全。
交货方式,送货至甲方指定地点。,交付方式条款缺失或约定不明确，建议补充完整。,高,,交付地点应当约定明确至具体的地点。
验收期限,甲方应在产品送达后一天内组织验收，逾期视为验收合格|甲方收到货物后当天检验，逾期视为验收合格，放弃向乙方提出质量问题的权利。,验收期限约定过短，建议核实,高,"【《中华人民共和国民法典》第六百二十条】买受人收到标的物时应当在约定的检验期限内检验。没有约定检验期限的，应当及时检验。|【《中华人民共和国民法典》第六百二十一条】当事人约定检验期限的，买受人应当在检验期限内将标的物的数量或者质量不符合约定的情形通知出卖人。买受人怠于通知的，视为标的物的数量或者质量符合约定。
当事人没有约定检验期限的，买受人应当在发现或者应当发现标的物的数量或者质量不符合约定的合理期限内通知出卖人。买受人在合理期限内未通知或者自收到标的物之日起二年内未通知出卖人的，视为标的物的数量或者质量符合约定；但是，对标的物有质量保证期的，适用质量保证期，不适用该二年的规定。
出卖人知道或者应当知道提供的标的物不符合约定的，买受人不受前两款规定的通知时间的限制。|【《中华人民共和国民法典》第六百二十二条】当事人约定的检验期限过短，根据标的物的性质和交易习惯，买受人在检验期限内难以完成全面检验的，该期限仅视为买受人对标的物的外观瑕疵提出异议的期限。
约定的检验期限或者质量保证期短于法律、行政法规规定期限的，应当以法律、行政法规规定的期限为准。|【《中华人民共和国民法典》第六百二十三条】当事人对检验期限未作约定，买受人签收的送货单、确认单等载明标的物数量、型号、规格的，推定买受人已经对数量和外观瑕疵进行检验，但是有相关证据足以推翻的除外。",买卖合同应当约定合理的验收期限以及验收的异议时间。
付款方式与期限,甲方在本合同签订之日一次性付款,付款方式为一次性支付款项，增加了交易风险,高,,付款比例应公平、合理
付款条件,甲方收到乙方交付的叉车，登记上牌后支付货款,付款条件约定过高，建议核实,高,,付款条件对于交易双方应公平、合理
开票缺失,本次交易不开票|无需开票,填开发票的单位和个人必须在发生经营业务确认营业收入时开具发票。,高,【《中华人民共和国发票管理办法》】第二十条 销售商品、提供服务以及从事其他经营活动的单位和个人，对外发生经营业务收取款项，收款方应向付款方开具发票；特殊情况下由付款方向收款方开具发票。,填开发票的单位和个人必须在发生经营业务确认营业收入时开具发票。
合同解除,除非经经双方协商同意，本协议不能以任何方式解除、改变、变更、修改。|本合同一经签订，任何一方禁止解除。|任何一方不得提前解除本合同。,合同解除条款缺失或约定不明确，建议补充完整。,高,"【《中华人民共和国民法典》第五百六十二条】当事人协商一致，可以解除合同。当事人可以约定一方解除合同的事由。解除合同的事由发生时，解除权人可以解除合同。|【《中华人民共和国民法典》第五百六十三条】有下列情形之一的，当事人可以解除合同：（一）因不可抗力致使不能实现合同目的；（二）在履行期限届满前，当事人一方明确表示或者以自己的行为表明不履行主要债务；（三）当事人一方迟延履行主要债务，经催告后在合理期限内仍未履行；（四）当事人一方迟延履行债务或者有其他违约行为致使不能实现合同目的；（五）法律规定的其他情形。以持续履行的债务为内容的不定期合同，当事人可以随时解除合同，但是应当在合理期限之前通知对方。|【《中华人民共和国民法典》第五百九十七条】因出卖人未取得处分权致使标的物所有权不能转移的，买受人可以解除合同并请求出卖人承担违约责任。
法律、行政法规禁止或者限制转让的标的物，依照其规定。",合同解除后，尚未履行的，终止履行；已经履行的，根据履行情况和合同性质，当事人可以请求恢复原状或者采取其他补救措施，并有权请求赔偿损失。
违约责任,违约金为本合同总额的30%。|违约方应支付本合同金额40%的违约金。|每逾期一日，违约方应按未支付款项的1%计算的违约金支付守约方,约定违约金的，违约金不得超过损失的30%。,高,"【《中华人民共和国民法典》第五百七十七条】当事人一方不履行合同义务或者履行合同义务不符合约定的，应当承担继续履行、采取补救措施或者赔偿损失等违约责任。|【《中华人民共和国民法典》第五百八十三条】当事人一方不履行合同义务或者履行合同义务不符合约定的，在履行义务或者采取补救措施后，对方还有其他损失的，应当赔偿损失。|【《中华人民共和国民法典》第五百八十五条】当事人可以约定一方违约时应当根据违约情况向对方支付一定数额的违约金，也可以约定因违约产生的损失赔偿额的计算方法。
约定的违约金低于造成的损失的，人民法院或者仲裁机构可以根据当事人的请求予以增加；约定的违约金过分高于造成的损失的，人民法院或者仲裁机构可以根据当事人的请求予以适当减少。
当事人就迟延履行约定违约金的，违约方支付违约金后，还应当履行债务。",若约定违约金，违约金数额不能过高，超过实际损失30%的违约金会被法院认定为过高，建议根据实际情况合理确定违约金数额。
违约责任,乙方违约，甲方有权在应付款中直接扣除违约款,违约责任较严格，增加卖方交易风险，建议核实。,中,,履行合约过程中产生争议，双方应友好协商。
定金,甲方应在本合同签订之日当天支付本合同总价21%的定金,约定的定金过高，建议核实。双方约定的定金不得超过合同总价的20%，超过的部分不产生定金的效力。,中,"【《中华人民共和国民法典》第五百八十六条】当事人可以约定一方向对方给付定金作为债权的担保。定金合同自实际交付定金时成立。
定金的数额由当事人约定；但是，不得超过主合同标的额的百分之二十，超过部分不产生定金的效力。实际交付的定金数额多于或者少于约定数额的，视为变更约定的定金数额。|【《中华人民共和国民法典》第五百八十七条】债务人履行债务的，定金应当抵作价款或者收回。给付定金的一方不履行债务或者履行债务不符合约定，致使不能实现合同目的的，无权请求返还定金；收受定金的一方不履行债务或者履行债务不符合约定，致使不能实现合同目的的，应当双倍返还定金。|【《中华人民共和国民法典》第五百八十八条】当事人既约定违约金，又约定定金的，一方违约时，对方可以选择适用违约金或者定金条款。定金不足以弥补一方违约造成的损失的，对方可以请求赔偿超过定金数额的损失。",双方约定的定金不得超过合同总价的20%，超过的部分不产生定金的效力。
产品单价,"当市场价格升高或降低的，双方可以另行议价。|价格随市场指导价同步浮动|价格根据市场价格变动、调整
",价格不固定，建议核实。如价格产生变动建议另行签署补充协议。,中,,价格一经商定，经协议约定，对双方均具有约束力，随意商定价格，将增加交易风险。
安装调试维修,产品如出现故障，乙方应在2个工作日内维修完毕。|乙方应在甲方通知后十日内维修完毕,附加服务期限不合理，建议核实。,中,,货物的安装和调试等附加服务，买卖双方需明确、合理约定安装调试维修的期限及标准等内容。
争议解决,争议可以向仲裁机构申请仲裁也可以向人民法院起诉,"争议解决条款缺失或约定不明确，建议补充完整。
如发生争议双方应友好协商解决。如果管辖法院约定不明确，一般应根据《民事诉讼法》第二十三条规定“因合同纠纷提起的诉讼，由被告住所地或者合同履行地人民法院管辖”。既约定仲裁又约定了诉讼的争议条款的，一般认定为无效条款。",中,《仲裁法》司法解释第七条：当事人约定争议可以向仲裁机构申请仲裁也可以向人民法院起诉的，仲裁协议无效。但一方向仲裁机构申请仲裁，另一方未在仲裁法第二十条第二款规定期间内提出异议的除外。,争议解决条款是当事人针对后续可能发生的争议提前约定处理方式的条款。
